,X,Coauthor,Paper,Journal,AuthorID,PaperNO,PaperID,Author
308,308,AnupKumar,Comments on Area-Time Optimal Adder Design ,IEEE Trans Computers,20,6,308,CChen
309,309,,BISTSYN - A Built-In Self-Test Synthesizer ,ICCAD International Conference Computer Aided Design,20,7,309,CChen
310,310,,Comments on An Ensemble Average Classifier For Pattern Recognition Machines , Pattern Recognition,21,1,310,CChen
311,311,,Data Encryption Using MRF with an RSA Key ,IEEE Pacific Rim Conference Multimedia,21,2,311,CChen
312,312,CSChang CCChen,"Invariant Shape Features by Modified Moments, ",Proceedings of the Chinese Image Processing and Pattern Recognition Workshop Tainan,21,3,312,CChen
313,313,CSWWang YYChen,"Biometrics for Personal Identification/Verification, ",Image Processing and Pattern Recognition Chinese,21,4,313,CChen
314,314,CRCDubes,"Discrete MRF Model Parameters as Features for Texture Classification, ",IEEE Proceedings of Int l Conference Systems Man and Cybernetics Woodhill,21,5,314,CChen
315,315,CCChen,Data Encryption Using MRF an RSA Key , Lecture Notes Computer Science LNCS,21,6,315,CChen
316,316,Chien ChangChen,Filtering methods for texture discrimination ,Pattern Recognition Letters,21,7,316,CChen
317,317,CCChen,"Watermarking Experiments Based on Wavelet Transforms, ",The Proceedings of SPIE The International Society for Optical Engineering Int l Conference Electronic Imaging and Multimedia Technology III Shainhai,21,20,317,CChen
318,318,CCCChen,Gabor Transform in Texture Analysis , Proceedings of SPIE The International Society for Optical Engineering The International Society for Optical Engineering Intelligent Robots and Computer Vision XIII edited by David P Casasent,21,8,318,CChen
319,319,CCChen,"Applications of ICM Segmentation Algorithm, ",Proceedings of International Computer Symposium Hsinchu,21,21,319,CChen
320,320,YWChen CCChen,"Vector Quantization by Principal Component Analysis, ",Proceedings of the th Canadian Image Processing and Pattern Recognition Conference B C,21,9,320,CChen
321,321,CCCChen,"Zerotree Wavelet Transform for Texture Discrimination, ",Proceedings of the th Chinese Image Processing and Pattern Recognition Workshop Wu Lye Taipei County,21,22,321,CChen
322,322,CJHHsieh,"Singular Value Decomposition for Texture Compression, ",IEEE Proceedings of Data Compression Conference Snowbird,21,23,322,CChen
323,323,CHTChu,"A Study on Image Compression by Wavelet Transform, ",IEEE Workshop Consumer Electronics Taipei,21,24,323,CChen
324,324,CJHLuo,"Texture Discrimination Using Singular Value Decomposition, ",Proceedings IASTED,21,25,324,CChen
325,325,CCCChen,"Texture Synthesis: Algorithms and Experiments, ",Proceedings of the th Chinese Image Processing and Pattern Recognition Workshop Guu Guan Taichung County,21,26,325,CChen
326,326,CCCChen,Texture Synthesis: A Review and Experiments , Journal of Information Science and Engineering,21,27,326,CChen
327,327,TYCheng CLHuang CCChen,Color Image Segmentation Using Scale Space Filter and Markov Random Field , Pattern Recognition,21,28,327,CChen
328,328,HTChu CCChen,Accelerating Fractal Compression a Real-time Decoder , Journal of Information Science and Engineering,21,29,328,CChen
329,329,HTChu CCChen,"Domain Indexing for Fractal Image Compression, ",The Proceedings of SPIE The International Society for Optical Engineering Int l Conference Visual Comminucations and Image Processing Perth,21,30,329,CChen
330,330,HTChu CCChen,"Fractal Models for D Image Synthesis, ",presented IEEE International Workshop Comsumers Electronics Taipei,21,31,330,CChen
331,331,HTChu CCChen,"A Fast Algorithm for Generating Fractals, ",The Proceedings of IEEE International Conference Pattern Recognition Barcelona,21,32,331,CChen
332,332,Hsueh TingChu,On bounding boxes of iterated function system attractors ,Computers amp Graphics,21,33,332,CChen
333,333,Hsuch TingChu,On Accelerating Fractal Compression ,Data Compression Conference,21,34,333,CChen
334,334,HTChu CCChen,"An Efficient Decoding Scheme for Fractal Images, ",IEEE Proceedings of the Int l Conference Image Processing TA,21,35,334,CChen
335,335,Hsueh TingChu,An Efficient Decoding Scheme for Fractal Image Compression ,ICIP International Conference Image Processing,21,36,335,CChen
336,336,HTChu CCChen,"Real-time Fractal Image Compression Domain Indexing, ",Proceedings of the th Chinese IPPR Workshop Wann Li,21,37,336,CChen
337,337,HTChu CCChen,"The Relationship between MPEG- standards and XML, ",Workshop of The WCE IEEE Consumer Electronics Society Hsinchu,21,38,337,CChen
338,338,RCDubes AKJain SGNadabar CCChen,"MRF Model-Based Algorithms for Image Segmentation, ",IEEE Proceedings of the th Int l Conference Pattern Recognition Atalantic City New,21,39,338,CChen
339,339,AKJain RCDubes CCChen,Bootstrapping for Error Estimation , IEEE Proceedings of the th Int l Conference Pattern Recognition,21,40,339,CChen
340,340,AKJain RCDubes CCChen,Bootstrap Techniques for Error Estimation , IEEE Trans Pattern Anal Machine Intell PAMI C C Chen R C Dubes and A K Jain Letter To The Editor,21,41,340,CChen
341,341,JHLuo CCChen,"Performance Evaluation for Shape Features, ",Proceedings SPIE The International Society for Optical Engineering Applications of Digital Image Processing XVI edited by Andrew G Terscher San Diego,21,42,341,CChen
342,342,JHLuo CCChen,"Singular Value Decomposition for Texture Analysis, ",Proceedings of SPIE The International Society for Optical Engineering Applications of Digital Image Processing XVI edited by Andrew G Terscher San Diego,21,43,342,CChen
343,343,YYWang CCChen,"An AFIS Using Fingerprint Classification, ",Proceedings of the th Chinese IPPR Workshop Kenting Ping Dong A,21,44,343,CChen
344,344,JYYang CCChen,Decomposition of Additively Separable Structuring Elements Applications , Pattern Recognition,21,45,344,CChen
345,345,CDCChen,Multi-resolutional Gabor Filter in Texture Analysis , Pattern Recognition Letters,21,10,345,CChen
346,346,CCChen,Improved Moment Invariants for Shape Discrimination , Pattern Recognition,21,11,346,CChen
347,347,CTITsai,"Improved Moment Invariants for Shape Discrimination, ",Proceedings of SPIE The International Society for Optical Engineering Applications of Digital Image Processing XV edited by Andrew G Terscher San Diego,21,12,347,CChen
348,348,CRCDubes,Experiments in Fitting Discrete Markov Random Fields to Textures , IEEE Proceedings of Conference Computer Vision and Pattern Recognition San Diego,21,13,348,CChen
349,349,CCLHuang,Markov Random Fields for Texture Discrimination , Pattern Recognition Letters,21,14,349,CChen
350,350,CYYWang,"An AFIS Using Fingerprint Classification, ",Image and Vision Computing New Zealand Conference Palmerston North,21,15,350,CChen
351,351,CRCDubes,Environmental Studies of ICM Segmentation Algorithm , Journal of Information Science and Engineering,21,16,351,CChen
352,352,CCChen,On Wavelet Features for Texture Discrimination , Proceedings of the th IPPR Conference Dah Ban Gern Taipei County,21,17,352,CChen
353,353,CCChen,A Nonparametric Test for Comparing Estimators in Markov Random Fields , Pattern Recognition Letters,21,18,353,CChen
354,354,CCChen,"On the Selection of Image Compression Algorithms, ",IEEE Proceedings of the th Int l Conference Pattern Recognition Brisbane,21,19,354,CChen
355,355,HenryHorng ShingLu Yao LinChen,A discrete region competition approach incorporating weak edge enhancement for ultrasound image segmentation ,Pattern Recognition Letters,22,1,355,CChen
356,356,Soo YoungLee,Analyzing Effect of Shared Data Replication on Minimizing Communication Overheads ,ICPP International Conference Parallel Processing,22,2,356,CChen
357,357,Soo YoungLee,Replication of uniformly accessed shared data for large-scale data-parallel algorithms ,IPPS International Parallel Processing Symposium,22,3,357,CChen
358,358,Soo YoungLee,Optimal Hot Spot Allocation on Meshes for Large-Scale Data-Parallel Algorithms ,IEEE Trans Parallel Distrib Syst,22,4,358,CChen
359,359,Soo YoungLee,On Parallelizing the EM Algorithm for PET Image Reconstruction ,IEEE Trans Parallel Distrib Syst,22,5,359,CChen
360,360,,An Efficient Four-Connected Parallel System for PET Image Reconstruction ,Parallel Computing,22,6,360,CChen
361,361,Sheng TzongCheng Chia MeiChen," Power Reduction for Real-Time Operating Systems,", to Real Time Systems the International Journal of Time Critical Computing Systems,23,12,361,CChen
362,362,Sheng TzongCheng Chia MeiChen," Temporal Analysis and Algorithms for Real-Time Scheduling and Allocation, ", the IJCA International Journal of Computers and Their Applications,23,13,362,CChen
363,363,Jing WenHwang Sheng TzongCheng,Low-Power Design for Real-Time Systems ,Real Time Systems,23,14,363,CChen
364,364,Shyh InHwang Chia MeiChen AshokKAgrawala," Scheduling an Overloaded Real-Time System ,",Procs of the IEEE International Conference Computers and Communications,23,15,364,CChen
365,365,CLi Chia MeiChen Sheng TzongCheng,Network topology management in a mobile-switch ATM network: dynamic partition algorithms ,Int Journal of Network Management,23,16,365,CChen
366,366,SatishKTripathi Sheng TzongCheng,A Fault-Tolerance Model for Multiprocessor Real-Time Systems ,J Comput Syst Sci,23,17,366,CChen
367,367,AlexBlackmore SatishKTripathi,A Resource Synchronization Protocol for Multiprocessor Real-Time Systems ,ICPP International Conference Parallel Processing,23,1,367,CChen
368,368,Chia MeiChen SatishKTripathi SCheng," A Fault-Tolerance Model for Real-Time Systems, ",Procs of the IEEE Workshop Fault Tolerant Parallel and Distributed Systems,23,2,368,CChen
369,369,Chia MeiChen SatishKTripathi," Fault-Tolerance Scheduling in Real-Time Systems, ",Procs of the International Society for Computers and Their Applications ISCA International Symposium Computer Architecture International Conference Computer Applications Industry and Engineering,23,3,369,CChen
370,370,Chia MeiChen SatishKTripathi," An Analytical Model for the Reliability of Real-Time Systems, ",Procs of the International Association of Science and Technology for Development IASTED International Conference Applied Modelling Simulation and Optimization,23,4,370,CChen
371,371,Chia MeiChen SatishKTripathi," An Optimistic Concurrency Control Algorithm in Real-Time Database Systems, ",Procc of the ISCA International Symposium Computer Architecture International Conference Parallel and Distributed Computing,23,5,371,CChen
372,372,CLi Sheng TzongCheng,Network topology management in a mobile-switch ATM network: dynamic partition algorithms ,Int Journal of Network Management,23,6,372,CChen
373,373,Chia MeiChen Shyh InHwang SatishKTripathi," A Performance Study of Real-Time Optimistic Concurrency Control the Knowledge of Execution time, ",International Journal of Computers and Their Applications II,23,7,373,CChen
374,374,Chia MeiChen SatishKTripathi AlexBlackmore, A Resource Synchronization Protocol for Multiprocessor Real-Time Systems ,Procs of the International Conference Parallel Processing,23,8,374,CChen
375,375,Chia MeiChen WHTsai," Automatic Identification of Chinese Seal Imprints Arbitrary or Partial Shapes, ",Computer Processing of Chinese and Oriental Languages An International Journal of the Chinese Language Computer Society,23,9,375,CChen
376,376,Sheng TzongCheng,Dynamic Round-based Resource Management for On-demand Multimedia Servers ,Comput J,23,10,376,CChen
377,377,Sheng TzongCheng Chia MeiChen Jing WenHwang," Low-Power Design for Real-Time Systems, ",Proc of the st International Conference Information Communications Signal Processing ICICS International Conference Information Communications and Signal Processing Signapore,23,11,377,CChen
378,378,Chi ChangChen Kin HsingHsieh," A Distributed Object-Oriented Parallel Computing Environment Based on Java/CORBA,", International Conference Parallel and Distributed Processing Techniques and Applications Las Vagas,24,1,378,CChen
379,379,Chi ChangChen JianerChen,"A homomorphism of the de bruijn graphs and its applications,",The First IEEE International Conference Algorithms and Architectures for Parallel Processing,24,2,379,CChen
380,380,Chi ChangChen JianerChen,Vertex-disjoint routing in star graphs, the First IEEE International Conference Algorithms and Architectures for Parallel Processing,24,3,380,CChen
381,381,Chi ChangChen JianerChen," A Linear Time Uniform Gap Algorithm,",Tatung Journal,24,4,381,CChen
382,382,Chi ChangChen JianerChen,Nearly Optimal One-to-Many Parallel Routing in Star Networks, th International Parallel Processing Symposium,24,5,382,CChen
383,383,JianerChen,Nearly Optimal One-to-Many Parallel Routing in Star Networks ,IEEE Trans Parallel Distrib Syst,24,6,383,CChen
384,384,C JChen," Nearly Optimal One-to-Many Routing in Star Networks,",IEEE Transactions Parallel and Distributed Systems,24,7,384,CChen
385,385,Chi ChangChen JianerChen,"One-to-many node-disjoint routing in star networks,", Technical Report,24,8,385,CChen
386,386,CJChen,"Optimal Parallel Routing in Star Graphs extended abastract ,", th International Workshop Graph Theoretic Concepts Computer Science Como Lecture Notes Computer Science,24,10,386,CChen
387,387,JianerChen,Optimal Parallel Routing in Star Graphs ,WG Workshop Graph Theoretic Concepts Computer Science,24,9,387,CChen
388,388,JianerChen,Optimal Parallel Routing in Star Networks ,IEEE Trans Computers,24,11,388,CChen
389,389,JianerChen,The Maximum Partition Matching Problem with Applications ,SIAM Society for Industrial and Applied Mathematics J Comput,24,12,389,CChen
390,390,Chi ChangChen JianerChen,"The maximum partition matching problem applications,",SIAM Society for Industrial and Applied Mathematics Journal Computing,24,13,390,CChen
391,391,CarloZaniolo JiejunKong,Design and Implementation of a Temporal Extension of SQL ,ICDE International Conference Data Engineering,25,1,391,CChen
392,392,CarloZaniolo,Universal Temporal Extensions for Database Languages ,ICDE International Conference Data Engineering,25,2,392,CChen
393,393,CarloZaniolo,Universal Temporal Data Languages ,DDLP,25,3,393,CChen
394,394,CarloZaniolo,SQL ST: A Spatio-Temporal Data Model and Query Language ,ER International Conference Conceptual Modeling the Entity Relationship Approach,25,4,394,CChen
395,395,AshokMalhotra,XML Queries via SQL ,Web Age Information Management,25,5,395,CChen
396,396,Kuo HaoLi,An Adaptive MAC Protocol for Satellite ATM ,ICOIN International Conference Information Networking,26,1,396,CChen
397,397,DharmaPAgrawal JRichardBurke Tsung YingLee,Performance Analysis of Single Stage Interconnection Networks ,IEEE Trans Computers,26,2,397,CChen
398,398,DharmaPAgrawal JRichardBurke,Design and Analysis of a Class of Highly Scalable Hierarchical Networks: PdBCube ,J Parallel Distrib Comput,26,3,398,CChen
399,399,DharmaPAgrawal JRichardBurke,dBCube: A New Class of Hierarchical Multiprocessor Interconnection Networks with Area Efficient Layout ,IEEE Trans Parallel Distrib Syst,26,4,399,CChen
400,400,DharmaPAgrawal JRichardBurke,Hybrid graph-based networks for multiprocessing ,Telecommunication Systems,26,5,400,CChen
401,401,NickRoussopoulos,Adaptive Database Buffer Allocation Using Query Feedback ,VLDB Very Large Data Bases,27,1,401,CChen
402,402,NickRoussopoulos,Adaptive Selectivity Estimation Using Query Feedback ,SIGMOD International Conference Management of Data Conference,27,2,402,CChen
403,403,AlexDelis NickRoussopoulos StephenKelley YannisPapakonstantinou,The ADMS Project: View R Us ,IEEE Data Eng Bull,27,3,403,CChen
404,404,NickRoussopoulos,The Implementation and Performance Evaluation of the ADMS Query Optimizer: Integrating Query Result Caching and Matching ,EDBT Extending Database Technology,27,4,404,CChen
405,405,KennethSalem MironLivny,The DBC: Processing Scientific Data Over the Internet ,ICDCS International Conference Distributed Computing Systems,27,5,405,CChen
406,406,Chin MingHong Heng KangFan,A New Gradient-Based Search Method: Grey-Gradient Search Model ,IEA Industrial and Engineering Applications AIE Artificial Intelligence and Expert Systems,28,1,406,CChen
407,407,Chin MingHong Heng KangFan,Design of Fuzzy Sliding Controller Based on Cerebellar Learning Model ,IEA Industrial and Engineering Applications AIE Artificial Intelligence and Expert Systems,28,2,407,CChen
408,408,Cheng WeiHwang Hahn MingLee,A Neural Network Document Classifier with Linguistic Feature Selection ,IEA Industrial and Engineering Applications AIE Artificial Intelligence and Expert Systems,28,3,408,CChen
409,409,Hahn MingLee,An Efficient Gradient Forecasting Search Method Utilizing the Discrete Difference Equation Prediction Model ,Appl Intell,28,4,409,CChen
410,410,Hahn MingLee Tzong ChingHuang,Learning efficiency improvement of back-propagation algorithm by error saturation prevention method ,Neurocomputing,28,5,410,CChen
411,411,Wen YangLin,Minimum Completion Time Criterion for Parallel Sparse Cholesky Factorization ,ICPP International Conference Parallel Processing,29,1,411,CChen
412,412,Wen YangLin,On Optimal Fill-Preserving Orderings of Sparse Matrices for Parallel Cholesky Factorizations ,IPDPS International Parallel and Distributed Processing Symposium,29,2,412,CChen
413,413,Chung KaiLiao,Analysis of Vector Access Performance on Skewed Interleaved Memory ,ISCA International Symposium Computer Architecture,29,3,413,CChen
414,414,Biing FengWang Gen HueyChen,A Simple Approach to Implementing Multiplication with Small Tables ,Inf Process Lett,29,4,414,CChen
415,415,Tsung TsoKan,Processor Allocation and Task Scheduling to Minimize Ditributed Sparse Cholesky Faxtorization Time ,HPCN European International Conference High Performance Computing and Networking Europe,29,5,415,CChen
416,416,LGasman,The Broadband Jigsaw Puzzle, Business Communications Review iss,2,30,416,CChen
417,417,DGetchell,LLNL Experience HIPPI, Santa Fe Cray Users Group,2,31,417,CChen
418,418,ArifGhafoor,Special Issue on Multimedia Processing and Technology ,J Parallel Distrib Comput,2,32,418,CChen
419,419,ArifGhafoor PBruceBerra ThomasDCLittle,Issues in Networking and Data MAnagement of Distributed Multimedia Systems ,HPDC High Performance Distributed Computing Symposium,2,33,419,CChen
420,420,TAGilbert,Using HIPPI Switches to Build High-Performance Multiple FDDI Ring Networks, SPIE The International Society for Optical Engineering High Speed Fiber Networks and Channels Proceedings,2,34,420,CChen
421,421,BillHalpin NareshSehgal,Timing Driven Placement using Physical Net Constraints ,DAC Design Automation Conference,2,35,421,CChen
422,422,KHardwick,HIPPI World --The Switch is the Network, COMPCON San Francisco,2,36,422,CChen
423,423,BHastings,HSSI and HPPI Open up Data Highways to High-Speed Traffic, Network World iss p,2,37,423,CChen
424,424,DikranSMeliksetian,Optimal Routing Algorithm and the Diameter of the Cube-Connected Cycles ,IEEE Trans Parallel Distrib Syst,2,70,424,CChen
425,425,KHerbst,Fast Track for Supercomputer Data, Datamation iss,2,38,425,CChen
426,426,DikranSMeliksetian TacettinKiprulu,Smoothing Algorithms for the Delivery of Compressed Video ,ICC International Conference Communications,2,71,426,CChen
427,427,KHerbst,The Dawning of the Age of Network Supercomputing, Supercomputing Review,2,39,427,CChen
428,428,MichaelZMoricz,Datapath Scheduling for Two-Level Pipelining ,DAC Design Automation Conference,2,72,428,CChen
429,429,MuhammadFMudawwar,The Signal Flow Model: A novel Data Driven Approach to Parallel Processing ,ICPP International Conference Parallel Processing,2,73,429,CChen
430,430,CheungN,Nectar HIPPI-ATM-SONET, Proceedings of the Third Gigabit Testbed Workshop,2,74,430,CChen
431,431,KingsleyCNwosu PBruceBerra,Modeling and Storage Allocation Strategies for Homogeneous Parallel Access Storage Devices in Real Time Multimedia Information Processing ,ICCI International Conference Computing and Information,2,75,431,CChen
432,432,KingsleyCNwosu PBruceBerra,Multimedia Object Modeling and Storage Allocation Strategies ,J Intell Inf Syst,2,76,432,CChen
433,433,EOhrenstein,Arrays - Fault Tolerance for VME and HPPI, Computer Technology Review iss,2,77,433,CChen
434,434,EOhrenstein,Supercomputers Seek High Throughput and Expandable Storage, Computer Technology Review iss,2,78,434,CChen
435,435,JohnKRenwick,Building a Practical HIPPI LAN, Proceedings of IEEE Conference Local Computer Networks,2,79,435,CChen
436,436,CHildebrand,`Hippi' Means Speed for Lab Users, Computerworld,2,40,436,CChen
437,437,BHoman CStoops, High Performance I/O and the RS/ , RiSc World,2,41,437,CChen
438,438,CliffYungchinHou,A Hierarchical Methodology to Improve Channel Routing by Pin Permutation ,ICCAD International Conference Computer Aided Design,2,42,438,CChen
439,439,CliffYungchinHou,A Pin Permutation Algorithm for Improving Over-the-Cell Channel Routing ,DAC Design Automation Conference,2,43,439,CChen
440,440,CalvinJAHsia,Permutation Capability of Multistage Interconnection Networks ,ICPP International Conference Parallel Processing,2,44,440,CChen
441,441,CalvinJAHsia,Synthesis of Asynchronous Circuits - Testing Unique Circuit Behavior of Signal Transition Graphs ,ISCAS IEEE International Symposium Circuits and Systems,2,45,441,CChen
442,442,Shuo HsienHsiao,A New Model for the Performance Evaluation of Synchronous Circuit Switched Multistage Interconnection Networks ,IPPS International Parallel Processing Symposium,2,46,442,CChen
443,443,Shuo HsienHsiao,Performance Evaluation of Circuit Switched Multistage Interconnection Networks Using a Hold Strategy ,IEEE Trans Parallel Distrib Syst,2,47,443,CChen
444,444,,Los Alamos High-Speed Channel will Spur Gigabits/s Networks, Computers Physics,2,1,444,CChen
445,445,PRRupert,What's Driving Gigabit/Sec Channels?, SPIE The International Society for Optical Engineering High Speed Fiber Networks and Channels Proceedings,2,80,445,CChen
446,446,WStJohn DMassey,Casa HIPPI-SONET, Proceedings of the Third Gigabit Testbed Workshop,2,48,446,CChen
447,447,,A Superhighway for Channeling Data, Science News p,2,2,447,CChen
448,448,SScully,Supercomputing Hails Need for Gbit LANs, Lightwave,2,81,448,CChen
449,449,WtJohn," High-Performance Parallel Interface HIPPI Repeater Application Note ,",Los Alamos National Laboratory,2,49,449,CChen
450,450,,Super High-Speed Link may Revolutionize Computer Communications, Computer Daily,2,3,450,CChen
451,451,JShandle,Gigabit Nets get Ready for Lift-Off, Electronics,2,82,451,CChen
452,452,JohnMAcken QinghongWu,Efficent Boolean Matching Algorithm for Cell Libraries ,ICCD International Conference Computer Design,2,4,452,CChen
453,453,RKSingh etal,A Programmable HIPPI Interface for a Graphics Supercomputer, Supercomputing Proceedings,2,83,453,CChen
454,454,JohnMAcken NareshKumarSeghal,A High Performance General Purpose Multi-Point Signal Router ,ISCAS IEEE International Symposium Circuits and Systems,2,5,454,CChen
455,455,UminderSingh,A Transistor Reordering Technique for Gate Matrix Layout ,DAC Design Automation Conference,2,84,455,CChen
456,456,ImtiazAhmad,Post-Processor for Data Path Synthesis Using Multiport Memories ,ICCAD International Conference Computer Aided Design,2,6,456,CChen
457,457,LSloan," Survey of `IP and ARP on HIPPI' Implementations ,",,2,85,457,CChen
458,458,ImtiazAhmad MuhammadKDhodhi,Synthesis of Application-Specific Multiprocessor Systems ,EDAC ETC EUROASIC,2,7,458,CChen
459,459,NPSmith,HIPPI and Beyond, Supercomputing Review,2,86,459,CChen
460,460,KCYoungetal,A HIPPI/ATM/SONET Network Interface for the Nectar Gigabit Testbed, IEEE LEOS Summer Topical Meeting Digest Gigabit Networks,2,8,460,CChen
461,461,AbdulazizSAlmazyad Shuo HsienHsiao,A new model for the performance evaluation of synchronous circuit switched multistage interconnection networks ,IEEE ACM Trans Netw,2,9,461,CChen
462,462,PeterASteenkiste BrianDZill HTKung StevenJSchlick JimHughes BobKowalski JohnMullaney,A Host Interface Architecture of High-Speed Networks, Proceedings of the th IFIP International Federation for Information Processing Conference High Performance Networks Liege A,2,87,462,CChen
463,463,PeterASteenkiste MichaelHemy ToddMummert BrianZill," Architecture and Evaluation of a High-Speed Networking Subsystem for Distributed-Memory Systems ,",Proceedings of the IEEE st Annual International Symposium Computer,2,88,463,CChen
464,464,PSteenkiste," A Systematic Approach to Host Interface Design for High-Speed Networks ,",IEEE Computer,2,89,464,CChen
465,465,MohammedAloqeely,Sequencer-Based Data Path Synthesis of Regular Iterative Algorithms ,DAC Design Automation Conference,2,10,465,CChen
466,466,JAmbrosio,Users: `We Want Our Data Faster', Computerworld iss p,2,11,466,CChen
467,467,BradleySCarlson DikranSMeliksetian,Dual Eulerian Properties of Plane Multigraphs ,SIAM Society for Industrial and Applied Mathematics J Discrete Math,2,12,467,CChen
468,468,BradleySCarlson,Performance Enhancement of CMOS VLSI Circuits by Transistor Reordering ,DAC Design Automation Conference,2,13,468,CChen
469,469,DETolmie,What's Happening Supercomputer Networks, Keynote Address at Network Systems Users Group NEXUS XXIV,2,100,469,CChen
470,470,BradleySCarlson DikranSMeliksetian,Transistor Chaining in Static CMOS Functional Cells of Arbitrary Planar Topology ,Discrete Applied Mathematics,2,14,470,CChen
471,471,DETolmie,Present and Future Supercomputer Network Architectures, SPIE The International Society for Optical Engineering High Speed Fiber Networks and Channels Proceedings,2,101,471,CChen
472,472,CSChang PBruceBerra ThomasDCLittle,Multimedia Synchronization ,IEEE Data Eng Bull,2,15,472,CChen
473,473,DETolmie,The High-Speed Channel HSC and Ultra-Speed Networks, Broadband FOC LAN San Francisco,2,102,473,CChen
474,474,IChlamtac AGanz MGKienzle,Control Policies for Interconnected Distributed Systems via a HIPPI Switch, Microprocessing Microprogramming iss,2,16,474,CChen
475,475,DETolmie,The High-Speed Channel HSC Standard, COMPCON Conference San Francisco,2,103,475,CChen
