,X,Coauthor,Paper,Journal,AuthorID,PaperNO,PaperID,Author
1,1,DavidChenhoKung JerryGao PeiHsia YasufumiToyoshima,Object-Oriented Software Testing: Some Research and Development ,HASE,10,1,1,CChen
2,2,DavidChenhoKung FWen JerryGao PeiHsia YasufumiToyoshima,Change Impact Identification in Object Oriented Software Maintenance ,ICSM International Conference Software Maintenance,10,2,2,CChen
3,3,DavidChenhoKung JerryGao PeiHsia YasufumiToyoshima,A Test Strategy for Object-Oriented Programs ,COMPSAC International Computer Software and Applications Conference,10,3,3,CChen
4,4,DavidKLeung JerryGao YasufumiToyoshima,Developing an Integrated Testing Environment Using the World Wide Web Technology ,COMPSAC International Computer Software and Applications Conference,10,4,4,CChen
5,5,DavidChenhoKung JerryZGao PeiHsia YasufumiToyoshima,Object state testing for object-oriented programs ,COMPSAC International Computer Software and Applications Conference,10,5,5,CChen
6,6,DavidChenhoKung JayarajanSamuel JerryGao PeiHsia YasufumiToyoshima,Formal Approach to Scenario Analysis ,IEEE Software,10,6,6,CChen
7,7,DavidChenhoKung JerryGao PeiHsia YasufumiToyoshima,Or Regression Testing of Object-Oriented Programs ,Journal of Systems and Software,10,7,7,CChen
8,8,DavidChenhoKung JerryGao PeiHsia YasufumiToyoshima Young KeeSong Young SiKim,Developing an Object-Oriented Software Testing and Maintenance Environment ,Commun ACM,10,8,8,CChen
9,9,DavidKLeung JerryGao YasufumiToyoshima,Engineering on the Internet for Global Software Production ,IEEE Computer,10,9,9,CChen
10,10,Ting YuanWang Jeng LiangTsai CharlieChung PingChen," Power-Delivery Networks Optimization Thermal Reliability Integrity, ",ACM International Symposium Physical Design ISPD International Symposium Physical Design,11,40,10,CChen
11,11,Ting YuanWang CharlieChung PingChen," Optimization of the Power/Ground Network Wire-Sizing and Spacing Based on Sequential Network Simplex Algorithm, ", rd International Symposium Quality Electronic Design ISQED,11,41,11,CChen
12,12,Ting YuanWang CharlieChung PingChen," SPICE-Compatible Thermal Simulation Lumped Circuit Modeling for Thermal Reliability Analysis based on Model Reduction, ", th International Symposium Quality Electronic Design ISQED,11,42,12,CChen
13,13,Ting YuanWang CharlieChung PingChen," Thermal-ADI: A Linear-Time Chip-Level Dynamic Thermal Simulation Algorithm Based on Alternating-Direction-Implicit ADI Method, ",ACM International Symposium Physical Design ISPD International Symposium Physical Design slide,11,43,13,CChen
14,14,Ting YuanWang CharlieChung PingChen," Thermal-ADI: A Linear-Time Chip-Level Dynamic Thermal Simulation Algorithm Based on Alternating-Direction-Implicit ADI Method, ",IEEE Transaction Very Large Scale Integration Systems TVLSI pp,11,44,14,CChen
15,15,Ting YuanWang Jeng LiangTsai CharlieChung PingChen," Thermal and Power Integrity based Power/Ground Networks Optimization, ",Design Automation and Test Europe Conference and Exhibition DATE Design Automation and Test Europe,11,45,15,CChen
16,16,Tsung HaoChen Hyoung SukKim CharlieChung PingChen, L Extracted? Now What? Introduction to An Inductance-Wise Interconnect Simulation Engine INDUCTWISE , Technical Report University of,11,10,16,CChen
17,17,Tsung HaoChen ClementLuk CharlieChung PingChen," INDUCTWISE: Inductance-Wise Interconnect Simulator and Extractor, ",IEEE Transactions Computer Aided Design of Integrated Circuits and Systems TCAD pp,11,11,17,CChen
18,18,Tsung HaoChen ClementLuk HyungsukKim CharlieChung PingChen," INDUCTWISE: Inductance-Wise Interconnect Simulator and Extractor, ",IEEE ACM International Conference Computer Aided Design ICCAD International Conference Computer Aided Design,11,12,18,CChen
19,19,Chung PingChen NMenezes," Noise-Aware Repeater Insertion and Wire-Sizing for On-chip Interconnect Using Hierarchical Moment-Matching, ",IEEE ACM Design Automation Conference DAC Design Automation Conference,11,13,19,CChen
20,20,Chung PingChen HaiZhou DFWong," Optimal Non-Uniform Wire-Sizing under the Elmore Delay Model, ",IEEE ACM International Conference Computer Aided Design ICCAD International Conference Computer Aided Design,11,14,20,CChen
21,21,Chung PingChen DFWong," Optimal Wire-Sizing Function Fringing Capacitance Consideration, ",IEEE ACM Design Automation Conference DAC Design Automation Conference,11,15,21,CChen
22,22,Chung PingChen Yao PingChen DFWong," Optimal Wire-Sizing Formula under the Elmore Delay Model, ",IEEE ACM Design Automation Conference DAC Design Automation Conference,11,16,22,CChen
23,23,Chung PingChen DFWong," Error-bounded Pade Approximation via Bilinear Conformal Transformation, ",IEEE ACM Design Automation Conference DAC Design Automation Conference,11,17,23,CChen
24,24,Tsung HaoChen ClementLuk CharlieChung PingChen," SuPREME: Substrate and Power-delivery Reluctance-Enhanced Macromodel Evaluation, ",IEEE ACM International Conference Computer Aided Design ICCAD International Conference Computer Aided Design,11,18,24,CChen
25,25,EdCheng,Future SoC Design Challenges and Solutions invited ,ISQED,11,19,25,CChen
26,26,SaisanthoshBalakrishnan JongHyukPark HyungsukKim Yu MinLee CharlieChung PingChen," Linear Time Hierarchical Capacitance Extraction Without Multipole Expansion, ",International Conference Computer Design ICCD International Conference Computer Design,11,1,26,CChen
27,27,YahongCao Yu MinLee Tsung HaoChen CharlieChung PingChen," HiPRIME: Hierarchical and Passivity Reserved Interconnect Macromodeling Engine for RLKC Power Delivery, ",IEEE ACM Design Automation Conference DAC Design Automation Conference,11,2,27,CChen
28,28,CharlieChung PingChen NarayananMurugesan Tae WooLee SusanCHagness," FDTD-ADI: An Unconditionally Stable Full Wave Maxwell Equation Solver for VLSI Modeling, ",IEEE ACM International Conference Computer Aided Design ICCAD International Conference Computer Aided Design,11,3,28,CChen
29,29,Tsung HaoChen CharlieChung PingChen," Efficient Large-Scale Power Grid Analysis Based on Preconditioned Krylov-Subspace Iterative Methods, ",IEEE ACM Design Automation Conference DAC Design Automation Conference,11,4,29,CChen
30,30,Chung PingChen DFWong," A Fast Algorithms for Optimal Wire-Sizing under the Elmore Delay Model, ",IEEE International Symposium Circuits and Systems ISCAS IEEE International Symposium Circuits and Systems,11,5,30,CChen
31,31,Chung PingChen ChrisCNChu DFWong," Fast and Exact Simultaneous Gate and Wire Sizing by Lagrangian Relaxation, ",IEEE Transactions Computer Aided Design of Integrated Circuits And Systems TCAD pp,11,6,31,CChen
32,32,PradeepsunderGanesh CharlieChung PingChen," RC-in RC-out Model Order Reduction Accurate Up to Second Order Moments, ",International Conference Computer Design ICCD International Conference Computer Design,11,20,32,CChen
33,33,Chung PingChen ChrisCNChu DFWong," Fast and Exact Simultaneous Gate and Wire Sizing by Lagrangian Relaxation, ",IEEE ACM International Conference Computer Aided Design ICCAD International Conference Computer Aided Design,11,7,33,CChen
34,34,RongJiang Tsung HaoChen CharlieChung PingChen," PODEA: POwer Delivery Efficient Analysis Realizable Model Reduction, ",IEEE International Symposium Circuits and Systems ISCAS IEEE International Symposium Circuits and Systems,11,21,34,CChen
35,35,Chung PingChen Yao WenChang DFWong," Fast performance-driven optimization for buffered clock trees based on Lagrangian relaxation, ",IEEE ACM Design Automation Conference DAC Design Automation Conference,11,8,35,CChen
36,36,RongJiang CharlieChung PingChen," Realizable Reduction for Electromagnetically Coupled RLMC Interconnects, ",Design Automation and Test Europe Conference and Exhibition DATE Design Automation and Test Europe,11,22,36,CChen
37,37,Tsung HaoChen YahongCao Yu MinLee,HiPRIME: hierarchical and passivity reserved interconnect macromodeling engine for RLKC power delivery ,DAC Design Automation Conference,11,9,37,CChen
38,38,RongJiang CharlieChung PingChen," SCORE: SPICE Compatible Reluctance Extraction, ",Design Automation and Test Europe Conference and Exhibition DATE Design Automation and Test Europe,11,23,38,CChen
39,39,HyungsukKim CharlieChung PingChen," Be Careful of Self and Mutual Inductance Formulae, ",,11,24,39,CChen
40,40,HyungsukKim JongHyukPark SaisanthoshBalakrishnan Yu MinLee,Linear Time Hierarchical Capacitance Extraction without Multipole Expansion ,ICCD International Conference Computer Design,11,25,40,CChen
41,41,Yu minLee CharlieChung PingChen," Hierarchical model order reduction for signal-integrity driven interconnect synthesis, ",Great Lakes Symposium VLSI Very Large Scale Integration GLSVLSI,11,26,41,CChen
42,42,Yu MinLee CharlieChung PingChen," Power Grid Transient Simulation in Linear Time Based on Transmission-Line-Modeling Alternating-Direction-Implicit Method, ",IEEE ACM International Conference Computer Aided Design ICCAD International Conference Computer Aided Design,11,27,42,CChen
43,43,Yu MinLee CharlieChung PingChen," Power Grid Transient Simulation in Linear Time based on Transmission-Line-Modeling Alternating-Direction-Implicit Method, ",IEEE Transactions Computer Aided Design of Integrated Circuits And Systems TCAD pp,11,28,43,CChen
44,44,Yu MinLee CharlieChung PingChen DFWong," Optimal Wire-sizing Function under the Elmore Delay Model Bounded Wiresizes, ",IEEE Transactions Circuits Systems I TCAS I pp,11,29,44,CChen
45,45,Yu MinLee HingYinLai CharlieChung PingChen," Optimal spacing and capacitance padding for general clock structures, ",Asian and South Pacific Design Automation Conference ASP DAC Design Automation Conference,11,30,45,CChen
46,46,Yu MinLee CharlieChung PingChen," The Power Grid Transient Simulation in Linear Time based on D Alternating-Direction-Implicit Method, ",Design Automation and Test Europe Conference and Exhibition DATE Design Automation and Test Europe,11,31,46,CChen
47,47,Yu MinLee CharlieChung PingChen," The Power Grid Transient Simulation in Linear Time based on D Alternating-Direction-Implicit Method, ",IEEE Transactions Computer Aided Design of Integrated Circuits And Systems TCAD pp,11,32,47,CChen
48,48,ClementLuk CharlieChung PingChen," Efficient Inductance Extraction for On-chip Interconnects, ",,11,33,48,CChen
49,49,NMenezes Chung PingChen," Spec-based Repeater Insertion and Wire-Sizing for On-chip Interconnect, ",Twelfth International Conference VLSI Very Large Scale Integration Design,11,34,49,CChen
50,50,NarayananMurugesan SusanCHagness Tae WooLee,Generalized FDTD-ADI: An Unconditionally Stable Full-Wave Maxwell's Equations Solver for VLSI Interconnect Modeling ,ICCAD International Conference Computer Aided Design,11,35,50,CChen
51,51,Jeng LaingTsai Tsung HaoChen CharlieChung PingChen," Zero-Skew Clock-Tree Optimization Buffer-Insertion/Sizing and Wire-Sizing, ",IEEE Transactions Computer Aided Design of Integrated Circuits And Systems TCAD,11,36,51,CChen
52,52,Jeng LaingTsai Tsung HaoChen CharlieChung PingChen," Epsilon-Optimal Zero-Skew Clock Tree Wire-Sizing in Pseudo-Polynomial Time, ",ACM International Symposium Physical Design ISPD International Symposium Physical Design,11,37,52,CChen
53,53,Ting YuanWang CharlieChung PingChen," -D Thermal-ADI: a linear-time chip level transient thermal simulator, ",IEEE Transactions Computer Aided Design of Integrated Circuits And Systems TCAD pp,11,38,53,CChen
54,54,Ting YuanWang Yu MinLee CharlieChung PingChen," D Thermal-ADI: An Efficient Chip-Level Transient Thermal Simulator, ",ACM International Symposium Physical Design ISPD International Symposium Physical Design Best Paper Award,11,39,54,CChen
55,55,CLPChen," Setup Generation and Feature Sequencing Using an Unsupervised Learning Algorithm, ",Neural Networks Design and Manufacturing Edited by J Wang and Yoshiyasu Takefuji World Scientific Publisher Inc,12,20,55,CChen
56,56,CLPChen CAWichman," A Systematic Approach for Design and Planning of Mechanical Assemblies, ",Artificial Intelligence for Engineering Design Analysis and Manufacturing,12,21,56,CChen
57,57,CLPChen," Automatic Generation Assembly Sequences by Pattern-Matching, ",IEEE Trans Systems Man and Cybernetics SMC,12,22,57,CChen
58,58,CLChen CSGLee CDMcGillem," Task Assignment and Load Balancing of Autonomous Vehicles in a Flexible Manufacturing System, ",IEEE Transaction Robotics and Automation RA,12,23,58,CChen
59,59,CDagli MAkay CLPhilipChen BRFernandez JGhosh, Intelligent Engineering Systems Through Artificial Neural Networks: Fuzzy Logic and Evolutionary Programming , ASME Press,12,24,59,CChen
60,60,CDagli MAkay CLPhilipChen BRFernandez JGhosh," Smart Engineering System Design: Neural Networks, Fuzzy Logic, and Evolutionary Programming ", ASME Press,12,25,60,CChen
61,61,PingGuo CLPhilipChen MichaelRLyu, Cluster Number Selection for a Small Set of Samples using the Bayesian Ying-Yang Model , IEEE Transactions Neural Networks,12,26,61,CChen
62,62,PGuo AASAwwal CLPChen," Dynamics of a Coupled Double-Cavity Optical Interference Filter, ",Journal of Modern Optics,12,27,62,CChen
63,63,T HGuo DLMatternLCJaw CLPChen, Model-Based Sensor Validation for a Turbofan Engine Using Auto-Associative Neural Networks , Journal of Smart Engineering Systems and Francis,12,28,63,CChen
64,64,PingGuo CLPhilipChen, Regularization Parameter Estimation Based on Bayesian-Kullback Data Smoothing Theory for Feedforward Neural Networks , IEEE Trans Systems Man and Cybernetics Part B,12,29,64,CChen
65,65,,,Integration of Rule Based and Neural Network for Assembly Planning,12,1,65,CChen
66,66,,* An Integration of Design and Manufacturing: A Learning-Based Approach,,12,2,66,CChen
67,67,,* A Rapid Stepwise Learning Algorithm for Flat Neural Networks and Self-Architecting Functional Basis Neural Networks,,12,3,67,CChen
68,68,," Solving Sequences of Interactive Features Using the Episodal Associative Memory, ",Artificial Intelligence for Engineering Design Analysis and Manufacturing,12,4,68,CChen
69,69,HNAl Kamhawi CLPChen SRLeClair," Feature Sequencing in the Rapid Design System Using a Genetic Algorithm, ",Journal of Intelligence Manufacturing,12,5,69,CChen
70,70,ChandrakumarBhumireddy,A Genetic Learning Algorithm for Generating a Parsimonious Functional Link Network ,Neural Networks and Computational Intelligence,12,6,70,CChen
71,71,CLPChen," Design of a Real-Time AND/OR Assembly Schedule on an Optimization Neural Network, ",Journal of Intelligent Manufacturing T E Westhoven C L P Chen Y H Pao and S R LeClair,12,7,71,CChen
72,72,CLChen CSGLee ESHHou," Efficient Scheduling Algorithm for Robot Inverse Dynamics Computation on a Multiprocessor System, ",IEEE Trans Systems Man and Cybernetics SMC,12,8,72,CChen
73,73,CLPChen YLu," FUZZ: A Fuzzy-Based Concept Formation System that Integrates Human Categorization and Numerical Clustering, ",IEEE Trans Systems Man and Cybernetics B,12,9,73,CChen
74,74,QHe HLi CLPhilipChen ESLee, Extension Principles and Fuzzy Set Categories , International Journal of Computers and Mathematics Applications Pergamon Press,12,30,74,CChen
75,75,StevenRLeClair Yoh HanPao,"An incremental adaptive implementation of functional-link processing for function approximation, time-series prediction, and system identification ",Neurocomputing,12,31,75,CChen
76,76,StevenRLeClair,Integration of design and manufacturing: solving setup generation and feature sequencing using an unsupervised-learning approach ,Computer Aided Design,12,32,76,CChen
77,77,CSGLee CLChen," Efficient Mapping Algorithms for Scheduling Robot Inverse Dynamics Computation on a Multiprocessor System, ",IEEE Trans Systems Man and Cybernetics SMC,12,33,77,CChen
78,78,HLi CLPhilipChen," DFE Method of Fuzzy Decision-Making: An Approach Based on Factor Spaces Theory, ",Fuzzy Sets and Systems Elsevier Science,12,34,78,CChen
79,79,HLi CLPhilipChen ESLee, Factor Spaces Theory and Fuzzy Information Processing: Fuzzy Decision Making Based on the Concepts of Feedback Extension , International Journal of Computers and Mathematics Applications Pergamon Press,12,35,79,CChen
80,80,HLi CLPhilipChen VCYen ESLee, Factor Spaces Theory and its Applications to Fuzzy Information Processing: Two Kinds of Factor Space Canes , International Journal of Computers and Mathematics Applications Pergamon Press,12,36,80,CChen
81,81,HongXingLi CLPhilipChen Han PangHuang, Fuzzy Neural Intelligent Systems: Mathematical Foundation and Application to Engineering , CRC Press ISBN pages,12,37,81,CChen
82,82,HLi CLPhilipChen ESLee," Mathematical Essence and Structures of Neural Networks and Fuzzy Neural Networks -- Part : On Functional-Link Neural Networks, ",International Journal of Mathematical Analysis and Applications,12,38,82,CChen
83,83,HLi CLPhilipChen ESLee," Mathematical Essence and Structures of Neural Networks and Fuzzy Neural Networks -- Part : On Forward Neural Networks, ",International Journal of Mathematical Analysis and Applications,12,39,83,CChen
84,84,HLi CLPhilipChen, The Equivalence Between Fuzzy Logic Systems and Feedback Forward Neural Networks , IEEE Trans Neural Networks,12,40,84,CChen
85,85,HLi CLPhilipChen, The Interpolation Mechanism of Fuzzy Control and its Relationship to PID Control , International Journal of Fuzzy Systems,12,41,85,CChen
86,86,MichaelRLyu PingGuo,Regularization parameter estimation for feedforward neural networks ,IEEE Transactions Systems Man and Cybernetics Part B,12,42,86,CChen
87,87,VincentASchmidt,Extracting Rules From the Aggregate feedforward Neural Network ,IC AI Artificial Intelligence,12,43,87,CChen
88,88,VASchmidt CLPhilipChen, Using the Aggregate Feedforward Neural Network for Rule Extraction , International Journal of Fuzzy Systems,12,44,88,CChen
89,89,YanWang YangXiao,An Optimal Distributed Call Admission Control for Adaptive Multimedia in Wireless/Mobile Networks ,MASCOTS INTERNATIONAL SYMPOSIUM MODELING ANALYSIS AND SIMULATION OF COMPUTER AND TELECOMMUNICATION SYSTEMS,12,45,89,CChen
90,90,YangXiao CLPhilipChen BWang, Bandwidth Degradation QoS for Adaptive Multimedia in Wireless/Mobile Networks , Computer Communications Elsevier Science,12,46,90,CChen
91,91,YangXiao CLPhilipChen YanWang, Call Admission Control and Bandwidth Reallocation Algorithm for Multi-Classes of Adaptive Multimedia Services in Wireless/Mobile Networks , Multiaccess Mobility and Teletraffic for Wireless Communications Volume Edited by Gordon L St ber and Bijan Jabbari Kluwer Academic Publishers,12,47,91,CChen
92,92,YangXiao,QoS for Adaptive Multimedia in Wireless/Mobile Networks ,MASCOTS INTERNATIONAL SYMPOSIUM MODELING ANALYSIS AND SIMULATION OF COMPUTER AND TELECOMMUNICATION SYSTEMS,12,48,92,CChen
93,93,YangXiao CLPhilipChen YanWang, Optimal Admission Control for Multi-Class of Wireless Adaptive Multimedia Services , IEICE Transactions Communications Special Issue Multimedia communications E B,12,49,93,CChen
94,94,CLPChen SXie," A Freedhand Drawing System using Fuzzy Concepts, ",Computer Aided Design Volume Number,12,10,94,CChen
95,95,CLPChen YCao SRLeClair," Materials structure-property prediction using a Self-Architecting Neural Network, ",Journal of Alloys and Compounds,12,11,95,CChen
96,96,CLPChen SXie AFuzzyFreedhandDrawingSystem," in Fuzzy Information Engineering: A Guided Tour of Applications, Edited by D Dubois, H Prade, and R Yager, John Wiley & Sons, - , ",,12,12,96,CChen
97,97,CLPChen SRLeClair Y HPao," An Incremental Adaptive Implementation of Functional-Link Process: for Function Approximation, Time-Series Prediction, and System Identification, ",Neurocomputing an International Journal,12,13,97,CChen
98,98,CLPChen SRLeClair," An Integration of Design and Manufacturing: Solving Setup Generation and Feature Sequencing Using Unsupervised Learning Approach, ",Computer Aided Design,12,14,98,CChen
99,99,CLPChen YHPao," An Integration of Neural Network and Rule-Based Systems for Design and Planning of Mechanical Assemblies, ",IEEE Trans Systems Man and Cybernetics SMC,12,15,99,CChen
100,100,Y CLPhilipChen," Proper Clamping Sequences in the Fixturing of Prismatic Workpieces, ",Engineering Design and Automation CRC Press,12,16,100,CChen
101,101,CLPChen JZWan," A Rapid Learning and Dynamic Stepwise Updating Algorithm for Flat Neural Networks and its Application to Time-Series Prediction, ",IEEE Trans Systems Man and Cybernetics,12,17,101,CChen
102,102,SenXie,Freehand drawing system using a fuzzy logic concept ,Computer Aided Design,12,50,102,CChen
103,103,CLPChen," A Rapid Supervised Learning Neural Network for Function Interpolation and Approximation, ",IEEE Trans Neural Networks,12,18,103,CChen
104,104,Qing WenYan ZeshengTang,Efficient algorithm for the reconstruction of D objects from orthographic projections ,Computer Aided Design,12,51,104,CChen
105,105,CLPChen SRLeClair Y HPao," A Rapid Supervised Learning Neural Network for Function Approximation and Time-Series Prediction using Adaptive Functional-Link Neural Network, ",Journal of Mathematical Modeling and Scientific Computing Principia Scientia,12,19,105,CChen
106,106,QWYan CLPChen ZTang," An Efficient Algorithm for Automatic Reconstruction of -D Objects from Orthographic Projections, ",Computer Aided Design,12,52,106,CChen
107,107,,A necessary condition for a graph to be the visibility graph of a simple polygon ,Theor Comput Sci,13,1,107,CChen
108,108,,Any Maximal Planar Graph with Only One Separating Triangle is Hamiltonian ,Journal of Combinatorial Optimization,13,2,108,CChen
109,109,RobinChi FengChan Zhi XinHong,A simple algorithm to find the steps of double-loop networks ,Discrete Applied Mathematics,13,3,109,CChen
110,110,Chin ChenChang,Connected Proper Interval Graphs and the Guard Problem in Spiral Polygons ,Combinatorics and Computer Science,13,4,110,CChen
111,111,GJChang YChen,"Vertex and tree arboricity of graphs, to",appear Journal of Combinatorial Optimization,13,5,111,CChen
112,112,Ruei ChuanChang,On the Minimality of Polygon Triangualtion ,BIT,13,6,112,CChen
113,113,KWu,"Disproving a conjecture on planar visibility graphs,",Theoretical Computer Science,13,7,113,CChen
114,114,FKHwang,"Equivalent L-shapes of double-loop networks for the degenerate case,",Journal of Interconnection Networks,13,8,114,CChen
115,115,FKHwang,"Equivalent nondegenerate L-shapes of double-loop networks,",Networks V,13,9,115,CChen
116,116,CChen,"A necessary condition for a graph to be the visibility graph of a simple polygon,",Theoretical Computer Sciencece,13,10,116,CChen
117,117,CChen,", On some polygon decomposition problems,",Ph D dissertation,13,11,117,CChen
118,118,RCChang,", On the minimality of polygon triangulation,",Bit,13,12,118,CChen
119,119,CChen,"Any maximal planar graph only one separating triangle is Hamiltonian,", Journal of Combinatorial Optimization,13,13,119,CChen
120,120,CCChang GJChang,", Proper interval graphs and the guard problem, ",Discrete Mathematics,13,14,120,CChen
121,121,FKHwang,", The minimum distance diagram of double-loop networks,",IEEE Transactions Computers,13,15,121,CChen
122,122,FKHwang JSLee SJShih,"The existence of hyper-L triple loop networks,", Discrete Mathematics,13,16,122,CChen
123,123,LHHsu EYJean,"A class of additive multiplicative graph functions, Di",Discrete Mathematics,13,17,123,CChen
124,124,FKHwang,Equivalent L-Shapes of Double-Loop Networks for the Degenerate Case ,Journal of Interconnection Networks,13,18,124,CChen
125,125,FKHwang MMLiao CChen,", Supermodularity in various partition problems,",Journal of Global Optimization V,13,19,125,CChen
126,126,FKHwang,The Minimum Distance Diagram of Double-Loop Networks ,IEEE Trans Computers,13,20,126,CChen
127,127,Shiou YiLin,Planar Visibility Graphs ,CCCG Canadian Conference Computational Geometry,13,21,127,CChen
128,128,KaipingWu,Disproving a conjecture on planar visibility graphs ,Theor Comput Sci,13,22,128,CChen
129,129,JKGuo CHChen JDLee JMTsai," D Image Reconstruction of Brain Blood Vessels from Angiograms, ",Computers Mathematics Applications,14,13,129,CChen
130,130,Jinn KweiGuo Rein LienHsu Yung NienSun,Detecting Corners of Polygonal and Polyhedral Objects ,CAIP Computer Analysis of Images and Patterns,14,14,130,CChen
131,131,JKKuo CHChen JDLee," Multi-Polyhedron Reconstruction in a Three-View System Using Relaxation, ",Signal Processing,14,15,131,CChen
132,132,Chi SungLaih Jau YienLee LeinHarn,A New Scheme for ID-Based Cryptosystems and Signature ,INFOCOM The Conference Computer Communications,14,16,132,CChen
133,133,JSLee CHChen YNSun," Occluded Object recognition Using Multiscale Features and Hopfield Neural Networks, ",Pattern Recognition,14,17,133,CChen
134,134,JLWu CHChen CFChen g, Numerical Inversion of Laplace Transform Using Haar Wavelet Operational Matrices , g IEEE Trans Circuits and Systems Part C C Chang S M Liang Y R Pu C H Chen I Manousakas T,14,50,134,CChen
135,135,gLee, D Registration of SPECT and CT Images for Liver Diagnosis , g ICEMI Beijing,14,18,135,CChen
136,136,KHWu CHChen JDLee JMKo," Path Planning and Prototype Design of an AGV, ",Mathematical and Computer Modelling,14,51,136,CChen
137,137,Jau YienLee Jiann DerLee Yuan ChiuanYou,Determining Location and Orientation of A Labelled Cylinder Using Point-Pair Estimation Algorithm ,IJPRAI International Journal of Pattern Recognition and Artificial Intelligence,14,19,137,CChen
138,138,KHWu CHChen JDLee," A Ring-Cache Genetic Algorithm for Tuning Reliable Fussy Logic Controller, ", IEEE International Conference SMC U S A,14,52,138,CChen
139,139,DLYang CHChen," A Bit Level Systolic Array for Bidirectional Associate Memories , ",SCI Scalable Coherent Interface Caracas,14,53,139,CChen
140,140,DLYang CHChen gDa, Data Dependence Analysis and Bit-Level Systolic Arrays of the Median Filter , g IEEE Trans Circuits and Systems for Video Technology,14,54,140,CChen
141,141,CIYu Chun HanChen Jinn KweiGuo Yen ChingYu Yung NienSun, -D Cerebral Vessel Reconstruction from Angiograms ,CAIP Computer Analysis of Images and Patterns,14,55,141,CChen
