,X,Coauthor,Paper,Journal,AuthorID,PaperNO,PaperID,Author
637,637,MengChangChen YealiSSun,PVA: a self-adaptive personal view agent system ,KDD Knowledge Discovery and Data Mining,44,4,637,CChen
638,638,KuoJuiWu MengChangChen, Automatic Topic Discovery From Hyperlinked Text ,National Computer Symposium,44,5,638,CChen
639,639,Kuo JuiWu MengChangChen YealiSun," Automatic Topics Discovery from Hyperlinked Documents ,", Journal of Information Processing and Management,44,6,639,CChen
640,640,Chung TaKing Yuun YenChen,Branch merging for effective exploitation of instruction-level parallelism ,MICRO International Symposium Microarchitecture,45,1,640,CChen
641,641,Chung TaKing,Designing Dynamic Two-Level Branch Predictors Based on Pattern Locality ,Euro Par II,45,2,641,CChen
642,642,Chung TaKing,Walk-Time Address Adjustment for Improving the Accuracy of Dynamic Branch Prediction ,IEEE Trans Computers,45,3,642,CChen
643,643,,Error-Correcting Codes with Byte Error-Detection Capability ,IEEE Trans Computers,46,1,643,CChen
644,644,DouglasCBossen LihCChang,Measurement and Generation of Error Correcting Codes for Package Failures ,IEEE Trans Computers,46,2,644,CChen
645,645,GoseleC HongL KreitlerT RossmannM HiekeB GrossU KramerM HimmelbauerH BihoreauMT K TwiggerS TonellatoPJ JacobHJ SchalkwykLC LindpaintnerK GantenD LehrachH KnoblauchM,"High-throughput scanning of the rat genome using interspersed repetitive sequence-PCR markers,",Genomics,46,3,645,CChen
646,646,AWCowley Roman GreeneRJ TonellatoA JacobP,"Chromosomal Pattern of Quantitative Trait Loci in the Brown Norway and Dahl S Intercross,",Physiological Research P,46,4,646,CChen
647,647,AWCowley Stoll GreeneM KaldunskiAS RomanML TonellatoRJ SchorkP JacobNJ,"Genetically defined risk of salt-sensitivity within a population of F rats from a Brown Norway and Dahl S derived intercross,",Physiological Genomics Press,46,5,647,CChen
648,648,AWCowley TonellatoPJ,"The Physiome: Tool for Physiological Genomics,",Proceedings of Designing the Physiome Project,46,6,648,CChen
649,649,ASGreene PJTonellato JLui JLombard CowleyAW,"Microvascular rarefaction and tissue vascular resistance in hypertension: Total peripheral resistance in hypertension,",American Journal of Physiology Heart and Circulatory Physiology H H,46,7,649,CChen
650,650,ASGreene PJTonellato JLombard AWCowley,"The contribution of microvascular rarefaction to tissue oxygen delivery in hypertension,",American Journal of Physiology Heart and Circulatory Physiology H H,46,8,650,CChen
651,651,NoraEH TonellatoPJ GreeneAS,"Quantification of the Contribution of Type and Type Angiotensin II Receptors to the Net Tissue Specific Effect of Angiotensin II,",Annals of Biomedical Engineering,46,9,651,CChen
652,652,TonellatoPJ Chen D Wang Z Wang T,"MetaGene: A Comprehensive Sequence Analysis and Annotation Platform,",Bioinformatics,46,10,652,CChen
653,653,CMKendziorski JBBassingthwaighte PJTonellato,"Evaluating Maximum Likelihood estimation methods to determine the Hurst Coefficient,",Physica A,46,11,653,CChen
654,654,AnneEKwitek Black PeterJTonellato DanChen JoGullings Handley YongjianSamuelCheng SimonTwigger ToddEScheetz ThomasLCasavant MonikaStoll MarceloANobrega MasahideShiozawa MBentoSoares ValCSheffield HowardJJacob,"Automated Construction of High-Density Comparative Maps Between Rat, Human, and Mouse",Genome Research,46,12,654,CChen
655,655,DOLomen AWWarrick TonellatoPJ,"Salt and water transport in unsaturated soil for non-conservative systems,",Agricultural Water Management,46,13,655,CChen
656,656,JLu AKwitek Black HJJacob PJTonellato,"A Web-based Rat Radiation Hybrid Map Server, Rat",Genome,46,14,656,CChen
657,657,KendziorskiCM Cowley AW  Greene AS Stoll M Salgado HC Jacob HJ TonellatoPJ,"Using Mechanistic Mapping to Locate Genes Involved In Complex Regulatory Reflexes,",Nature Genetics,46,15,657,CChen
658,658,DKNewton Nash PJTonellato MSwiersz AbromoffP,"Assessment of chemo kinetic behavior of inflammatory lung macrophages in a linear under-agarose assay,",Journal of Leukocyte Biology,46,16,658,CChen
659,659,ASPopel ASGreene CGEllis KFLey TCSkalak PJTonellato,"The Microcirculation Physiome Project,",Annals of Biomedical Engineering,46,17,659,CChen
660,660,MJRieder DMO Drobinak PJTonellato ASGreene,"Mathematical Analysis of Type-I and Type-IIb Muscle Fiber Force Generation in Renal Hypertension,",Annals of Biomedical Engineering,46,18,660,CChen
661,661,RGSteen AKwitek Black CGlenn JGullings Handley WVanEttenVan OSAtkinson DAppel STwigger MMuir TMull MGranados MKissebah KRusso RCrane MPopp MPeden TMatise DMBrown JLu SKingsmore PJTonellato SRozen DSlonim PYoung MKnoblauch AProvoost DGanten SColeman JRothberg ESLander HJJacob,"A high density intergrated genetic linkage and radiation hybrid map of the laboratory rat,",Genome Research AP AP,46,19,661,CChen
662,662,DonaldTTang,Logic Test Pattern Generation Using Linear Codes ,IEEE Trans Computers,46,20,662,CChen
663,663,MichaelAThomas Chin FuChen MichaelIJensen Seaman PeterJTonellato SimonNTwigger,"Phylogenetics of Rat Inbred Strains,",Mammalian Genome,46,21,663,CChen
664,664,PTonellato CMKendziorski AWCowley,"Characterization of blood pressure dynamics of the rat: a model based approach,",The Americal Physiological Society,46,22,664,CChen
665,665,PJTonellato,"Critical behavior of an ignition model in chemical combustion,",Quarterly of Applied Mathematics,46,23,665,CChen
666,666,PJTonellato ASGreene,"Oxygen Distribution in the Microvascular System,",Pixel The Magazine of Scientific Visualization,46,24,666,CChen
667,667,STwigger JLu MShimoyama DPasko PLong JGinster CFChen RNigam DChen ZWang AKwitek Black JEppig DMaglott GSchuler FStahl GLevan HJacob PJTonellato,"Rat Genome Database: A comparative genomics platform for rat, mouse and human,",Journal of Molecular Medicine B,46,25,667,CChen
668,668,SimonTwigger JianLu MaryShimoyama DeyingChen DeanPasko HanpingLong JessicaGinster Chin FuChen RajniNigam AnneKwitek Black JananEppig LoisMaltais DonnaMaglott GregSchuler HowardJacob PeterTonellato,"Rat Genome Database RGD - mapping disease onto the genome,",Nucleic Acids Res,46,26,668,CChen
669,669,AWWarrick DOLomen TonellatoPJ,"Soil and moisture flow for point and line sources computer programs for linear zed solutions,",Technical Report Agricultural Engineering and Soil Science Department of Soils Water Engineering University of,46,27,669,CChen
670,670,EJWeldon WWPeterson,Some Results on Quasi-Cyclic Codes,Information and Control,47,1,670,CChen
671,671,,On Shortened Finite Geometry Codes,Information and Control,47,2,671,CChen
672,672,SLin,Further Results on Polynomial Codes,Information and Control,47,3,672,CChen
673,673,ClementTYu KLam MKSiu,File Allocation in Distributed Databases with Interaction between Files ,VLDB Very Large Data Bases,48,1,673,CChen
674,674,ClementTYu,Adaptive Information System Design: One Query at a Time ,SIGMOD International Conference Management of Data Conference,48,2,674,CChen
675,675,ClementTYu KLam Man KeungSiu,Adaptive File Allocation in Star Computer Network ,IEEE Trans Software Eng,48,3,675,CChen
676,676,ZhengpingWu,A new foreground extraction scheme for video streams ,ACM Multimedia,49,1,676,CChen
677,677,JiajunBu XueyiWang,Research on Reliable Communication in Real-Time Collaborative Designing Systems ,DCW,49,2,677,CChen
678,678,JiajunBu XueyiWang,Achieving undo in bitmap-based collaborative graphics editing systems ,CSCW Conference Computer Supported Cooperative Work,49,3,678,CChen
679,679,EdwardAAshton JeffreyWeisberg KevinJParker LeenaKetonen MichelJBerg,"Segmentation and Features Extraction Techniques, with Applications to Biomedical Images ",ICIP International Conference Image Processing,4,10,679,CChen
680,680,JianfeiCai,FEC-Based Wireless Video Streaming with Pre-Interleaving ,Data Compression Conference,4,11,680,CChen
681,681,LeiCao,Product Code and Recurrent Alternative Decoding for Wireless Image Transmission ,Data Compression Conference,4,12,681,CChen
682,682,MatthewArrott ThomasSHuang,"Modeling, Analysis, and Visualization of Left Ventricle Shape and Motion by Hierarchical Decomposition ",IEEE Transactions Pattern Analysis and Machine Intelligence,4,13,682,CChen
683,683,JianWang,A Fast and Effective Block-Matching Error Concealment Scheme ,IEEE Pacific Rim Conference Multimedia,4,14,683,CChen
684,684,LeiCao,A Novel Product Coding and Decoding Scheme for Wireless Image Transmission ,ICIP International Conference Image Processing,4,1,684,CChen
685,685,HongzhiLi,Joint Source and Channel Optimized Block TCQ with Layered Transmission and RCPC ,ICIP International Conference Image Processing,4,2,685,CChen
686,686,JieboLuo KevinJParker ThomasSHuang,Three Dimensional Subband Video Analysis and Synthesis with Adaptive Clustering in High Frequency Subbands ,ICIP International Conference Image Processing,4,3,686,CChen
687,687,JieboLuo KevinJParker ThomasSHuang,Adaptive quantization with spatial constraints in subband video compression using wavelets ,ICIP International Conference Image Processing,4,4,687,CChen
688,688,JieboLuo KevinJParker ThomasSHuang,A Knowledge-Based Approach to Volumetric Medical Image Segmentation ,ICIP International Conference Image Processing,4,5,688,CChen
689,689,LiFan,An Improved Approach for Cardiac Dynamics Analysis based on Constrained Local Force Model ,ICIP International Conference Image Processing,4,6,689,CChen
690,690,JianZhou YiliangWang YueYu,A High Performance VBR Coding Algorithm for Fixed Size Storage Applications ,ICIP International Conference Image Processing,4,7,690,CChen
691,691,JieboLuo KevinJParker,Face location in wavelet-based video compression for high perceptual quality videoconferencing ,ICIP International Conference Image Processing,4,8,691,CChen
692,692,HongzhiLi JieboLuo,Ultrasound Image Compression Based on Subband Decomposition and Speckle Synthesis ,ICIP International Conference Image Processing,4,9,692,CChen
693,693,CLLiu TingTingHwang,Architecture driven circuit partitioning ,ICCAD International Conference Computer Aided Design,50,1,693,CChen
694,694,CLLiu TingTingHwang,Low Power FPGA Design - A Re-engineering Approach ,DAC Design Automation Conference,50,2,694,CChen
695,695,Kuang HuiLin TingTingHwang,Layout Driven Selecting and Chaining of Partial Scan ,DAC Design Automation Conference,50,3,695,CChen
696,696,ChunwuWu MilesNWernick,A -D Filtered-Backprojection Reconstruction Algorithm for Combined Parallel- and Cone-Beam SPECT Data ,IPMI Information Processing Medical Imaging,51,1,696,CChen
697,697,JohnNAarsvold WingHWong XiaochuanPan,Analytical Considerations of Photon Attenuation and System Response Function in SPECT Reconstruction ,IPMI Information Processing Medical Imaging,51,2,697,CChen
698,698,W YLin,On Evaluating Parallel Sparse Cholesky Factorizations ,ICPADS International Conference Parallel and Distributed Systems,52,1,698,CChen
699,699,W YLin,Minimum communication cost reordering for parallel sparse Cholesky factorization ,Parallel Computing,52,2,699,CChen
700,700,,A fuzzy approach to select the location of the distribution center ,Fuzzy Sets and Systems,53,1,700,CChen
701,701,Hsi MeiHsu,Fuzzy Credibility Relation Method for Multiple Criteria Decision-Making Problems ,Inf Sci,53,2,701,CChen
702,702,MohanMTrivedi,Sensor-Driven Intelligent Robotics ,Advances Computers,54,1,702,CChen
703,703,MohanMTrivedi SureshBMarapane,A Vision System for Robotic Inspection and Manipulation ,IEEE Computer,54,2,703,CChen
704,704,Ming ShingYu RichardChia TungLee,Optimal Parallel Circle-Cover and Independent Set Algorithms for Circular-Arc Graphs ,ICPP International Conference Parallel Processing,55,1,704,CChen
705,705,MSYu RCTLee,An Optimal Parallel Algorithm for Minimum Coloring of Intervals ,ICPP International Conference Parallel Processing,55,2,705,CChen
706,706,BingLiu JacquelineChame MaryWHall NastaranBaradaran PedroDiniz RobertLucas Yoon JuLee,ECO: An Empirical-Based Compilation and Optimization System ,IPDPS International Parallel and Distributed Processing Symposium,56,1,706,CChen
707,707,ChangWooKang CraigSSteele IhnKimGokhan JacquelineChame JaewookShin JeffLaCoss JeffreyTDraper JohnGranacki MaryWHall TimBarrett,The architecture of the DIVA processing-in-memory chip ,ICS International Conference Supercomputing,56,2,707,CChen
708,708,JacobAAbraham,Mixed-Level Sequential Test Generation Using a Nine-Valued Relaxation Algorithm ,ICCAD International Conference Computer Aided Design,57,1,708,CChen
709,709,JacobAAbraham,High Quality Tests for Switch-Level Circuits Using Current and Logic Test Generation Algorithms ,ITC International Test Conference,57,2,709,CChen
710,710,,"An Adaptive Protection Framework for MPEG Base Layer Video Streaming over the Internet,",Fourth International Conference Information Communications Signal Processing and Fourth Pacific Rim Conference Multimedia ICICS International Conference Information Communications and Signal Processing PCM,58,1,710,CChen
711,711,ChyouhwaChen," Measurements of a Multimedia Player,",ICOIN International Conference Information Networking,58,2,711,CChen
712,712,ChyouhwaChen Chih JenTseng Jiun YiLiu," The SOT Framework Re-examined, ", th International Conference Distributed Multimedia Systems,58,3,712,CChen
713,713,Chen LiangFang DeronLiang FengyiLin,A nested invocation suppression mechanism for active replication fault-tolerant CORBA ,APSEC,58,4,713,CChen
714,714,Chen LiangFang DeronLiang ChyouhwaChen PuSanLin," A Redundant Nested Invocation Suppression Mechanism for Active Replication Fault-Tolerant Web Service ,",IEEE International Conference e Technology e and e Service,58,5,714,CChen
715,715,DeronLiang Chen LiangFang Shyan MingYuan ChyouhwaChen GeneEuJan," A Fault-tolerant Object Service on CORBA, ",Journal of Systems and Software SCI Scalable Coherent Interface ELSEVIER SCIENCE INC,58,6,715,CChen
716,716,DeronLiang Chen LiangFang ChyouhwaChen FengyiLin,Fault tolerant web service,APSEC,58,7,716,CChen
717,717,DeronLiang Chen LiangFang ChyouhwaChen Ji ChiangTsai," A Nested Invocation Suppression Mechanism for Active Replication Fault-tolerant CORBA, ",IEEE COMPSAC International Computer Software and Applications Conference International Computer Software and Applications Conference,58,8,717,CChen
718,718,Chih YenLin ChyouhwaChen Wen JenHo,An Adaptive Protection Framework for MPEG base layer video streaming over the Internet,Poster presentation Packet Video,58,9,718,CChen
719,719,Chih YenLin I ChengTing Wen JenHo,An Error Resilient Scheme for MPEG- FGS Video over Packet Erasure Channel That Exhibits Graceful Degradation ,IEEE Pacific Rim Conference Multimedia,58,10,719,CChen
720,720,Chih YenLin I ChengTing ChyouhwaChen Wen JenHo,"An Error Resilient Scheme for MPEG- Fine-Granular-Scalability Video,",The Third IEEE Pacific Rim Conference Multimedia,58,11,720,CChen
721,721,K TTsai CChen, Deterministic Load Balancing Techniques for VBR Video Servers ,International Workshop Advanced Image Technology,58,12,721,CChen
722,722,Kuen tsengTsai ChyouhwaChen," A Fast Algorithm for the Video Assignment Problem, ",First International Workshop Intelligent Multimedia Computing and Networking IMMCN,58,13,722,CChen
723,723,Kuen tsengTsai ChyouhwaChen," Multiresolution Face Recognition, ",Fifth Conference Artificial Intelligence and Applications,58,14,723,CChen
724,724,Kuen tsengTsai ChyouhwaChen,"Two Algorithms for Multi-Constrained Optimal Multicast Routing,",IJCS,58,15,724,CChen
725,725,Chih JenTseng ChyouhwaChen," Exploiting the Temporal Dimention in QoS-aware Multicast Routing ,",Computer Communications pp,58,16,725,CChen
726,726,Chih JenTseng ChyouhwaChen, The Performance of QoS-aware Multicast Routing Protocols ,IEEE ICOIN International Conference Information Networking,58,17,726,CChen
727,727,Chih JenTseng ChyouhwaChen,"The Performance of QoS-aware IP Multicast Routing Protocols,",Networks SCI Scalable Coherent Interface JOHN WILEY SONS INC,58,18,727,CChen
728,728,Wen TzengHuang Woei kaeChen,Pancyclicity of M&ouml;bius cubes ,ICPADS International Conference Parallel and Distributed Systems,59,1,728,CChen
729,729,Wen TzengHuang Woei kaeChen,On the Fault-Tolerant Pancyclicity of Crossed Cubes ,ICPADS International Conference Parallel and Distributed Systems,59,2,729,CChen
730,730,CCChang RichardCTLee,Optimal MMI file systems for orthogonal range retrieval ,Inf Syst,5,10,730,CChen
731,731,CCChang,On GDM allocation for partial range queries ,Inf Syst,5,11,731,CChen
732,732,HFLin,Optimality Criteria of the Disk Modulo Allocation Method for Cartesian Product Files ,BIT,5,12,732,CChen
733,733,CCChang,Performance of Two-Disk Partition Data Allocations ,BIT,5,13,733,CChen
734,734,Chin ChenChang HFLin RichardCTLee,Optimal Bucket Allocation Design of k-ary MKH Files for Partial Match Retrieval ,IEEE Trans Knowl Data Eng,5,14,734,CChen
735,735,Chin ChenChang DCLin RichardCTLee,Optimal Linear Hashing Files for Orthogonal Range Retrieval ,COMPSAC International Computer Software and Applications Conference,5,1,735,CChen
736,736,Chin ChenChang DCLin RichardCTLee,A Temporal Join Mechanism Based on Trie-Ranking Data Structure ,CODAS The Second International Symposium Cooperative Database Systems for Advanced Applications,5,2,736,CChen
737,737,CCChang,Orthogonal Range Retrieval Using Bucket Address Hashing ,SSDBM Statistical and Scientific Database Management,5,3,737,CChen
738,738,CCChang HYChen,Symbolic Gray Code As A Data Allocation Scheme For Two-Disc Systems ,Comput J,5,4,738,CChen
739,739,CCChang JKJan,On the Design of a Machine-Independent Perfect Hashing Scheme ,Comput J,5,5,739,CChen
740,740,Chin ChenChang HFLin,Optimality Properties of the Disc Modulo Allocation Method for k-ary Multiple Key Hashing Files ,Comput J,5,6,740,CChen
741,741,CCChang,Performance Analysis of the Generalised Disc Modulo Allocation method for Multiple Key Hashing Files on Multi-Disc Systems ,Comput J,5,7,741,CChen
742,742,CCChang,A Recursive Performance Formula of the Disc Modulo Allocation Method for Binary Cartesian Product Files ,Comput J,5,8,742,CChen
743,743,CCChang RichardCTLee,On the design of multiple key hashing files for concurrent orthogonal range retrieval between two disks ,Inf Syst,5,9,743,CChen
744,744,ChandramouliVisweswariah RakeshChadha,Model Development and Verification for High Level Analog Blocks ,DAC Design Automation Conference,60,1,744,CChen
745,745,Foong CharnChang PrasadSubramaniam,An Accurate and Efficient Gate Level Delay Calculator for MOS Circuits ,DAC Design Automation Conference,60,2,745,CChen
746,746,SubrataBanerjee,Optical Switch Configuration and Lightpath Assignment in Wavelength Routing Multihop Lightwave Networks ,INFOCOM The Conference Computer Communications,61,1,746,CChen
747,747,SubrataBanerjee,A New Model for Optimal Routing and Wavelength Assignment in Wavelength Division Multiplexed Optical Networks ,INFOCOM The Conference Computer Communications,61,2,747,CChen
748,748,KInoue SEChick Chun HungChen," An Empirical Evaluation of Several Methods to Select the Best System, ",ACM Transitions Modeling and Computer Simulation,6,10,748,CChen
749,749,JLin EYcesan SEChick Chun HungChen," Simulation Budget Allocation for Further Enhancing the Efficiency of Ordinal Optimization, ",Journal of Discrete Event Dynamic Systems Theory and Applications,6,11,749,CChen
750,750,EnverY uuml cesan Hsiao ChangChen LiyiDai,New Development of Optimal Computing Budget Allocation for Discrete Event Simulation ,Winter Simulation Conference,6,20,750,CChen
751,751,YCLuo MGuignard Spielberg Chun HungChen," A Hybrid Approach for Integer Programming Combining Genetic Algorithms, Linear Programming and Ordinal Optimization, ",Journal of Intelligent Manufacturing,6,12,751,CChen
752,752,EnverY uuml cesan Hsiao ChangChen JianwuLin,An asymptotic allocation for simultaneous simulation experiments ,Winter Simulation Conference,6,21,752,CChen
753,753,YCLuo MGuignard Spielberg Chun HungChen," An Efficient Approach Integrating Genetic Algorithm, Linear Programming, and Ordinal Optimization for Linear Mixed Integer Programming Problems, ",International Journal of Smart Engineering System Design,6,13,753,CChen
754,754,EnverY uuml cesan LeyuanShi,Simultaneous simulation experiments and nested partition for discrete resource allocation in supply chain management ,Winter Simulation Conference,6,22,754,CChen
755,755,LShi Chun HungChen," A New Algorithm for Stochastic Discrete Resource Allocation Optimization, ",Journal of Discrete Event Dynamic Systems Theory and Applications,6,14,755,CChen
756,756,EYcesan YCLuo ILee Chun HungChen," Distributed Web-Based Simulation Experiments For Optimization, ",Journal of Simulation Practice Theory,6,23,756,CChen
757,757,EnverY uuml cesan Hsiao ChangChen LiyiDai YuYuan,Computing Budget Allocation for Simulation Experiments with Different System Structure ,Winter Simulation Conference,6,15,757,CChen
758,758,EYcesan LDai HChun HungChen," Efficient Computation of Optimal Budget Allocation for Discrete Event Simulation Experiment, ", IIE Transactions,6,24,758,CChen
759,759,EnverY uuml cesan InsupLee Yuh ChuynLuo,Distributed web-based simulation experiments for optimization ,Simul Theory,6,16,759,CChen
760,760,EnverY uuml cesan InsupLee Yuh ChuynLuo,Distributed web-based simulation optimization ,Winter Simulation Conference,6,17,760,CChen
761,761,EnverY uuml cesa JianwuLin KarenDonohue,Efficient Approach for Monte Carlo Simulation Experiments and Its Applications to Circuit Systems Design ,Annual Simulation Symposium,6,18,761,CChen
762,762,EnverY uuml cesan InsupLee,Web-based Simulation Experiments ,Winter Simulation Conference,6,19,762,CChen
763,763,,A Hybrid Approach of the Standard Clock Method and Event Scheduling Approach for General Discrete Event Simulation ,Winter Simulation Conference,6,1,763,CChen
764,764,Chun HungChen ," Very Efficient Simulation for Engineering Design Problem, ",Modeling and Simulation Based Life Cycle Engineering K Chong S Saigal S Thynell Ed s Spon Press London,6,2,764,CChen
765,765,HEYucesan Chun HungChen," Computing Efforts Allocation for Ordinal Optimization and Discrete Event Simulation, ",IEEE Transactions Automatic Control,6,3,765,CChen
766,766,Hsiao ChangChen LiyiDai,A Gradient Approach for Smartly Allocating Computing Budget for Discrete Event Simulation ,Winter Simulation Conference,6,4,766,CChen
767,767,LDai JRBirge Chun HungChen," Large Convergence Properties of Two-Stage Stochastic Programming, ",Journal of Optimization Theory and Applications,6,5,767,CChen
768,768,KDonohue EYcesan JLin Chun HungChen," Optimal Computing Budget Allocation for Monte Carlo Simulation Application to Product Design, ", Journal of Simulation Practice and Theory,6,6,768,CChen
769,769,YCHo CGCassandras LDai Chun HungChen," Ordinal Optimization and Simulation, ",Journal of Operational Research Society,6,7,769,CChen
770,770,Bo WeiHsieh Shi ChungChang,Dynamic Scheduling Rule Selection for Semiconductor Wafer Fabrication ,ICRA International Conference Robotics and Automation,6,8,770,CChen
771,771,BWHsieh SCChang Chun HungChen," Scheduling Semiconductor Wafer Fabrication by Using Ordinal Optimization-Based Simulation, ",IEEE Transactions Robotics and Automation,6,9,771,CChen
772,772,SajalKDas SushilKPrasad,Efficient EREW PRAM Algorithms for Parentheses-Matching ,IEEE Trans Parallel Distrib Syst,7,10,772,CChen
773,773,HeeYongYoun,A Comprehensive Performance Evaluation of Crossbar Networks ,IEEE Trans Parallel Distrib Syst,7,11,773,CChen
774,774,SajalKDas,Parallel Breadth-First and Breadth-Depth Traversals of Generated Trees ,ICCI International Conference Computing and Information,7,1,774,CChen
775,775,GeneLewis SajalKDas SushilKPrasad,Some Fast Parallel Algorithms for Parentheses Matching ,ICCI International Conference Computing and Information,7,2,775,CChen
776,776,SajalKDas,Breadth-First Traversal of Trees and Integer Sorting in Parallel ,ICPP International Conference Parallel Processing,7,3,776,CChen
777,777,SajalKDas,Efficient Parallel Algorithms for Computing Articulation Points and Bridges of Interval Graphs ,ICPP International Conference Parallel Processing,7,4,777,CChen
778,778,SajalKDas,A New Parallel Algorithm for Breadth-First Search on Interval Graphs ,IPPS International Parallel Processing Symposium,7,5,778,CChen
779,779,SajalKDas,A Cost-Optimal Parallel Algorithm for the Parentheses Matching Problem on an EREW PRAM ,IPPS International Parallel Processing Symposium,7,6,779,CChen
780,780,SajalKDas,Efficient Parallel Algorithms on Interval Graphs ,PARLE Parallel Architectures and Languages Europe,7,7,780,CChen
781,781,SajalKDas SelimGAkl,A Unified Approach to Parallel Depth-First Traversals of General Trees ,Inf Process Lett,7,8,781,CChen
782,782,SajalKDas,Breadth-First Traversal of Trees and Integer Sorting in Parallel ,Inf Process Lett,7,9,782,CChen
783,783,DouglasCBossen MYBenHsiao,Fault Alignment Exclusion for Memory Using Address Permutation ,IBM Journal of Research and Development,8,4,783,CChen
784,784,MYBenHsiao,Error-Correcting Codes for Semiconductor Memory Applications: A State-of-the-Art Review ,IBM Journal of Research and Development,8,5,784,CChen
785,785,RobertARutledge,Fault-Tolerant Memory Simulator ,IBM Journal of Research and Development,8,6,785,CChen
786,786,DonaldTTang,Iterative Exhaustive Pattern Generation for Logic Testing ,IBM Journal of Research and Development,8,7,786,CChen
787,787,,Symbol Error-Correcting Codes for Computer Memory Systems ,IEEE Trans Computers,8,8,787,CChen
788,788,,Byte-Oriented Error-Correcting Codes for Semiconductor Memory Systems ,IEEE Trans Computers,8,9,788,CChen
789,789,LEGrosbach,Fault-Tolerant Memory Design in the IBM Application System/ ,FTCS Symposium Fault Tolerant Computing,8,10,789,CChen
790,790,BrianKTolan FritzFreie GeorgeCWellwood IndravadanNModi LuizCAlves MyronLFair NormanEWeber PatrickJMeaney WilliamJClarke,RAS design for the IBM eServer z ,IBM Journal of Research and Development,8,1,790,CChen
