,X,Coauthor,Paper,Journal,AuthorID,PaperNO,PaperID,Author
357,357,ClydeSMiller JohnPSchroeter LayLMyint RaymonMGlantz,Visual Signals in an Optomotor Reflex: Systems and Information Theoretic Analysis ,Journal of Computational Neuroscience,8,34,357,DJohnson
358,358,CRozell DHJohnson,Information processing during transient responses in the crayfish visual system ,,8,35,358,DJohnson
359,359,ChandranSeshagiri CharlotteMGruner KeithABaggerly,Information-Theoretic Analysis of Neural Coding ,Journal of Computational Neuroscience,8,36,359,DJohnson
360,360,SSinanovic DHJohnson,Toward a theory of information processing ,International Symposium Information Theory,8,37,360,DJohnson
361,361,WWang DHJohnson,Linear transforms of symbolic data ,IEEE Trans Signal Processing,8,38,361,DJohnson
362,362,LYue DHJohnson,Optimal binaural processing based on point process models of preprocessed cues ,J Acoust Soc Am,8,39,362,DJohnson
363,363,MZacksenhouse DHJohnson JWilliams  CTsuchitani,Single-neuron modeling of LSO unit responses ,J Neurophysiol,8,40,363,DJohnson
364,364,JudithGBrodman,What Small Business and Small Organizations Say About the CMM: Experience Report ,ICSE International Conference Software Engineering,9,1,364,DJohnson
365,365,JudithGBrodman,A Software Process Improvement Approach Tailored for Small Organizations and Small Projects Tutorial ,ICSE International Conference Software Engineering,9,2,365,DJohnson
366,366,JudithGBrodman,Return on Investment ROI from Software Process Improvement as Measured by US Industry ,Software Process Improvement and Practice,9,3,366,DJohnson
367,367,JudithGBrodman,Applying CMM Project Planning Practices to Diverse Environments ,IEEE Software,9,4,367,DJohnson
368,368,JudithGBrodman,Realities and Rewards of Software Process Improvement ,IEEE Software,9,5,368,DJohnson
